13:40:10.676627 IP (tos 0x48, ttl 64, id 21597, offset 0, flags [DF], proto TCP (6), length 60)
    192.168.56.1.48924 > 192.168.56.4.22: Flags [S], cksum 0xf184 (incorrect -> 0xc359), seq 1362456171, win 64240, options [mss 1460,sackOK,TS val 1784524590 ecr 0,nop,wscale 7], length 0
13:40:10.677337 IP (tos 0x0, ttl 64, id 0, offset 0, flags [DF], proto TCP (6), length 60)
    192.168.56.4.22 > 192.168.56.1.48924: Flags [S.], cksum 0x318c (correct), seq 481702584, ack 1362456172, win 65160, options [mss 1460,sackOK,TS val 2995227694 ecr 1784524590,nop,wscale 7], length 0
13:40:10.677376 IP (tos 0x48, ttl 64, id 21598, offset 0, flags [DF], proto TCP (6), length 52)
    192.168.56.1.48924 > 192.168.56.4.22: Flags [.], cksum 0xf17c (incorrect -> 0x5cea), ack 1, win 502, options [nop,nop,TS val 1784524591 ecr 2995227694], length 0
13:40:10.677724 IP (tos 0x48, ttl 64, id 21599, offset 0, flags [DF], proto TCP (6), length 73)
    192.168.56.1.48924 > 192.168.56.4.22: Flags [P.], cksum 0xf191 (incorrect -> 0x9224), seq 1:22, ack 1, win 502, options [nop,nop,TS val 1784524591 ecr 2995227694], length 21: SSH: SSH-2.0-OpenSSH_9.9
13:40:10.677838 IP (tos 0x0, ttl 64, id 10741, offset 0, flags [DF], proto TCP (6), length 52)
    192.168.56.4.22 > 192.168.56.1.48924: Flags [.], cksum 0x5ccd (correct), ack 22, win 509, options [nop,nop,TS val 2995227695 ecr 1784524591], length 0
13:40:10.694990 IP (tos 0x0, ttl 64, id 10742, offset 0, flags [DF], proto TCP (6), length 92)
    192.168.56.4.22 > 192.168.56.1.48924: Flags [P.], cksum 0xf7ba (correct), seq 1:41, ack 22, win 509, options [nop,nop,TS val 2995227712 ecr 1784524591], length 40: SSH: SSH-2.0-OpenSSH_9.2p1 Debian-2+deb12u3
13:40:10.695027 IP (tos 0x48, ttl 64, id 21600, offset 0, flags [DF], proto TCP (6), length 52)
    192.168.56.1.48924 > 192.168.56.4.22: Flags [.], cksum 0xf17c (incorrect -> 0x5c8a), ack 41, win 502, options [nop,nop,TS val 1784524608 ecr 2995227712], length 0
13:40:10.695623 IP (tos 0x48, ttl 64, id 21601, offset 0, flags [DF], proto TCP (6), length 1620)
    192.168.56.1.48924 > 192.168.56.4.22: Flags [P.], cksum 0xf79c (incorrect -> 0x36d4), seq 22:1590, ack 41, win 502, options [nop,nop,TS val 1784524609 ecr 2995227712], length 1568
13:40:10.697572 IP (tos 0x0, ttl 64, id 10743, offset 0, flags [DF], proto TCP (6), length 1164)
    192.168.56.4.22 > 192.168.56.1.48924: Flags [P.], cksum 0xc0b8 (correct), seq 41:1153, ack 1590, win 500, options [nop,nop,TS val 2995227714 ecr 1784524609], length 1112
13:40:10.738992 IP (tos 0x48, ttl 64, id 21603, offset 0, flags [DF], proto TCP (6), length 52)
    192.168.56.1.48924 > 192.168.56.4.22: Flags [.], cksum 0xf17c (incorrect -> 0x51ce), ack 1153, win 524, options [nop,nop,TS val 1784524652 ecr 2995227714], length 0
13:40:10.759137 IP (tos 0x48, ttl 64, id 21604, offset 0, flags [DF], proto TCP (6), length 1260)
    192.168.56.1.48924 > 192.168.56.4.22: Flags [P.], cksum 0xf634 (incorrect -> 0xba10), seq 1590:2798, ack 1153, win 524, options [nop,nop,TS val 1784524672 ecr 2995227714], length 1208
13:40:10.778647 IP (tos 0x0, ttl 64, id 10744, offset 0, flags [DF], proto TCP (6), length 1616)
    192.168.56.4.22 > 192.168.56.1.48924: Flags [P.], cksum 0xf798 (incorrect -> 0x560f), seq 1153:2717, ack 2798, win 501, options [nop,nop,TS val 2995227796 ecr 1784524672], length 1564
13:40:10.778680 IP (tos 0x48, ttl 64, id 21605, offset 0, flags [DF], proto TCP (6), length 52)
    192.168.56.1.48924 > 192.168.56.4.22: Flags [.], cksum 0xf17c (incorrect -> 0x4668), ack 2717, win 548, options [nop,nop,TS val 1784524692 ecr 2995227796], length 0
13:40:10.787233 IP (tos 0x48, ttl 64, id 21606, offset 0, flags [DF], proto TCP (6), length 68)
    192.168.56.1.48924 > 192.168.56.4.22: Flags [P.], cksum 0xf18c (incorrect -> 0x3c27), seq 2798:2814, ack 2717, win 548, options [nop,nop,TS val 1784524700 ecr 2995227796], length 16
13:40:10.881800 IP (tos 0x0, ttl 64, id 10746, offset 0, flags [DF], proto TCP (6), length 52)
    192.168.56.4.22 > 192.168.56.1.48924: Flags [.], cksum 0x4618 (correct), ack 2814, win 501, options [nop,nop,TS val 2995227899 ecr 1784524700], length 0
13:40:10.881843 IP (tos 0x48, ttl 64, id 21607, offset 0, flags [DF], proto TCP (6), length 96)
    192.168.56.1.48924 > 192.168.56.4.22: Flags [P.], cksum 0xf1a8 (incorrect -> 0x2edf), seq 2814:2858, ack 2717, win 548, options [nop,nop,TS val 1784524795 ecr 2995227899], length 44
13:40:10.882124 IP (tos 0x0, ttl 64, id 10747, offset 0, flags [DF], proto TCP (6), length 52)
    192.168.56.4.22 > 192.168.56.1.48924: Flags [.], cksum 0x458d (correct), ack 2858, win 501, options [nop,nop,TS val 2995227899 ecr 1784524795], length 0
13:40:10.882688 IP (tos 0x0, ttl 64, id 10748, offset 0, flags [DF], proto TCP (6), length 96)
    192.168.56.4.22 > 192.168.56.1.48924: Flags [P.], cksum 0x17ae (correct), seq 2717:2761, ack 2858, win 501, options [nop,nop,TS val 2995227900 ecr 1784524795], length 44
13:40:10.882828 IP (tos 0x48, ttl 64, id 21608, offset 0, flags [DF], proto TCP (6), length 112)
    192.168.56.1.48924 > 192.168.56.4.22: Flags [P.], cksum 0xf1b8 (incorrect -> 0xd772), seq 2858:2918, ack 2761, win 548, options [nop,nop,TS val 1784524796 ecr 2995227900], length 60
13:40:10.890215 IP (tos 0x0, ttl 64, id 10749, offset 0, flags [DF], proto TCP (6), length 104)
    192.168.56.4.22 > 192.168.56.1.48924: Flags [P.], cksum 0x2e63 (correct), seq 2761:2813, ack 2918, win 501, options [nop,nop,TS val 2995227907 ecr 1784524796], length 52
13:40:10.890428 IP (tos 0x48, ttl 64, id 21609, offset 0, flags [DF], proto TCP (6), length 552)
    192.168.56.1.48924 > 192.168.56.4.22: Flags [P.], cksum 0xf370 (incorrect -> 0x6c7a), seq 2918:3418, ack 2813, win 548, options [nop,nop,TS val 1784524804 ecr 2995227907], length 500
13:40:10.898482 IP (tos 0x0, ttl 64, id 10750, offset 0, flags [DF], proto TCP (6), length 104)
    192.168.56.4.22 > 192.168.56.1.48924: Flags [P.], cksum 0x883b (correct), seq 2813:2865, ack 3418, win 501, options [nop,nop,TS val 2995227915 ecr 1784524804], length 52
13:40:10.939047 IP (tos 0x48, ttl 64, id 21610, offset 0, flags [DF], proto TCP (6), length 52)
    192.168.56.1.48924 > 192.168.56.4.22: Flags [.], cksum 0xf17c (incorrect -> 0x4251), ack 2865, win 548, options [nop,nop,TS val 1784524852 ecr 2995227915], length 0
13:40:12.602409 IP (tos 0x48, ttl 64, id 21611, offset 0, flags [DF], proto TCP (6), length 136)
    192.168.56.1.48924 > 192.168.56.4.22: Flags [P.], cksum 0xf1d0 (incorrect -> 0x54ef), seq 3418:3502, ack 2865, win 548, options [nop,nop,TS val 1784526516 ecr 2995227915], length 84
13:40:12.646626 IP (tos 0x0, ttl 64, id 10751, offset 0, flags [DF], proto TCP (6), length 52)
    192.168.56.4.22 > 192.168.56.1.48924: Flags [.], cksum 0x34d8 (correct), ack 3502, win 501, options [nop,nop,TS val 2995229663 ecr 1784526516], length 0
13:40:12.654501 IP (tos 0x0, ttl 64, id 10752, offset 0, flags [DF], proto TCP (6), length 80)
    192.168.56.4.22 > 192.168.56.1.48924: Flags [P.], cksum 0x50b5 (correct), seq 2865:2893, ack 3502, win 501, options [nop,nop,TS val 2995229671 ecr 1784526516], length 28
13:40:12.654546 IP (tos 0x48, ttl 64, id 21612, offset 0, flags [DF], proto TCP (6), length 52)
    192.168.56.1.48924 > 192.168.56.4.22: Flags [.], cksum 0xf17c (incorrect -> 0x3451), ack 2893, win 548, options [nop,nop,TS val 1784526568 ecr 2995229671], length 0
13:40:12.654729 IP (tos 0x48, ttl 64, id 21613, offset 0, flags [DF], proto TCP (6), length 164)
    192.168.56.1.48924 > 192.168.56.4.22: Flags [P.], cksum 0xf1ec (incorrect -> 0x8a17), seq 3502:3614, ack 2893, win 548, options [nop,nop,TS val 1784526568 ecr 2995229671], length 112
13:40:12.654934 IP (tos 0x0, ttl 64, id 10753, offset 0, flags [DF], proto TCP (6), length 52)
    192.168.56.4.22 > 192.168.56.1.48924: Flags [.], cksum 0x340f (correct), ack 3614, win 501, options [nop,nop,TS val 2995229672 ecr 1784526568], length 0
13:40:12.696555 IP (tos 0x0, ttl 64, id 10754, offset 0, flags [DF], proto TCP (6), length 680)
    192.168.56.4.22 > 192.168.56.1.48924: Flags [P.], cksum 0x5e97 (correct), seq 2893:3521, ack 3614, win 501, options [nop,nop,TS val 2995229713 ecr 1784526568], length 628
13:40:12.738956 IP (tos 0x48, ttl 64, id 21614, offset 0, flags [DF], proto TCP (6), length 52)
    192.168.56.1.48924 > 192.168.56.4.22: Flags [.], cksum 0xf17c (incorrect -> 0x30d8), ack 3521, win 571, options [nop,nop,TS val 1784526652 ecr 2995229713], length 0
13:40:12.739737 IP (tos 0x0, ttl 64, id 10755, offset 0, flags [DF], proto TCP (6), length 96)
    192.168.56.4.22 > 192.168.56.1.48924: Flags [P.], cksum 0xfda3 (correct), seq 3521:3565, ack 3614, win 501, options [nop,nop,TS val 2995229756 ecr 1784526652], length 44
13:40:12.739812 IP (tos 0x48, ttl 64, id 21615, offset 0, flags [DF], proto TCP (6), length 52)
    192.168.56.1.48924 > 192.168.56.4.22: Flags [.], cksum 0xf17c (incorrect -> 0x3080), ack 3565, win 571, options [nop,nop,TS val 1784526653 ecr 2995229756], length 0
13:40:12.740013 IP (tos 0x48, ttl 64, id 21616, offset 0, flags [DF], proto TCP (6), length 436)
    192.168.56.1.48924 > 192.168.56.4.22: Flags [P.], cksum 0xf2fc (incorrect -> 0x847f), seq 3614:3998, ack 3565, win 571, options [nop,nop,TS val 1784526653 ecr 2995229756], length 384
13:40:12.742584 IP (tos 0x0, ttl 64, id 10756, offset 0, flags [DF], proto TCP (6), length 52)
    192.168.56.4.22 > 192.168.56.1.48924: Flags [.], cksum 0x2f43 (correct), ack 3998, win 501, options [nop,nop,TS val 2995229759 ecr 1784526653], length 0
13:40:12.745387 IP (tos 0x10, ttl 64, id 10757, offset 0, flags [DF], proto TCP (6), length 160)
    192.168.56.4.22 > 192.168.56.1.48924: Flags [P.], cksum 0x4378 (correct), seq 3565:3673, ack 3998, win 501, options [nop,nop,TS val 2995229762 ecr 1784526653], length 108
13:40:12.745983 IP (tos 0x10, ttl 64, id 10758, offset 0, flags [DF], proto TCP (6), length 528)
    192.168.56.4.22 > 192.168.56.1.48924: Flags [P.], cksum 0x7f40 (correct), seq 3673:4149, ack 3998, win 501, options [nop,nop,TS val 2995229763 ecr 1784526653], length 476
13:40:12.746116 IP (tos 0x48, ttl 64, id 21617, offset 0, flags [DF], proto TCP (6), length 52)
    192.168.56.1.48924 > 192.168.56.4.22: Flags [.], cksum 0xf17c (incorrect -> 0x2c96), ack 4149, win 593, options [nop,nop,TS val 1784526659 ecr 2995229762], length 0
13:40:12.774969 IP (tos 0x10, ttl 64, id 10759, offset 0, flags [DF], proto TCP (6), length 120)
    192.168.56.4.22 > 192.168.56.1.48924: Flags [P.], cksum 0x7b50 (correct), seq 4149:4217, ack 3998, win 501, options [nop,nop,TS val 2995229792 ecr 1784526659], length 68
13:40:12.815775 IP (tos 0x48, ttl 64, id 21618, offset 0, flags [DF], proto TCP (6), length 52)
    192.168.56.1.48924 > 192.168.56.4.22: Flags [.], cksum 0xf17c (incorrect -> 0x2bee), ack 4217, win 593, options [nop,nop,TS val 1784526729 ecr 2995229792], length 0
13:40:34.108948 IP (tos 0x48, ttl 64, id 21619, offset 0, flags [DF], proto TCP (6), length 88)
    192.168.56.1.48924 > 192.168.56.4.22: Flags [P.], cksum 0xf1a0 (incorrect -> 0xf1c6), seq 3998:4034, ack 4217, win 593, options [nop,nop,TS val 1784548022 ecr 2995229792], length 36
13:40:34.110383 IP (tos 0x10, ttl 64, id 10760, offset 0, flags [DF], proto TCP (6), length 88)
    192.168.56.4.22 > 192.168.56.1.48924: Flags [P.], cksum 0x1e1a (correct), seq 4217:4253, ack 4034, win 501, options [nop,nop,TS val 2995251128 ecr 1784548022], length 36
13:40:34.110419 IP (tos 0x48, ttl 64, id 21620, offset 0, flags [DF], proto TCP (6), length 52)
    192.168.56.1.48924 > 192.168.56.4.22: Flags [.], cksum 0xf17c (incorrect -> 0x851e), ack 4253, win 593, options [nop,nop,TS val 1784548024 ecr 2995251128], length 0
13:40:34.356349 IP (tos 0x48, ttl 64, id 21621, offset 0, flags [DF], proto TCP (6), length 88)
    192.168.56.1.48924 > 192.168.56.4.22: Flags [P.], cksum 0xf1a0 (incorrect -> 0x9970), seq 4034:4070, ack 4253, win 593, options [nop,nop,TS val 1784548270 ecr 2995251128], length 36
13:40:34.357840 IP (tos 0x10, ttl 64, id 10761, offset 0, flags [DF], proto TCP (6), length 88)
    192.168.56.4.22 > 192.168.56.1.48924: Flags [P.], cksum 0x6ea3 (correct), seq 4253:4289, ack 4070, win 501, options [nop,nop,TS val 2995251375 ecr 1784548270], length 36
13:40:34.357897 IP (tos 0x48, ttl 64, id 21622, offset 0, flags [DF], proto TCP (6), length 52)
    192.168.56.1.48924 > 192.168.56.4.22: Flags [.], cksum 0xf17c (incorrect -> 0x82e8), ack 4289, win 593, options [nop,nop,TS val 1784548271 ecr 2995251375], length 0
13:40:34.459197 IP (tos 0x48, ttl 64, id 21623, offset 0, flags [DF], proto TCP (6), length 88)
    192.168.56.1.48924 > 192.168.56.4.22: Flags [P.], cksum 0xf1a0 (incorrect -> 0x82df), seq 4070:4106, ack 4289, win 593, options [nop,nop,TS val 1784548372 ecr 2995251375], length 36
13:40:34.460864 IP (tos 0x10, ttl 64, id 10762, offset 0, flags [DF], proto TCP (6), length 88)
    192.168.56.4.22 > 192.168.56.1.48924: Flags [P.], cksum 0xa438 (correct), seq 4289:4325, ack 4106, win 501, options [nop,nop,TS val 2995251478 ecr 1784548372], length 36
13:40:34.460914 IP (tos 0x48, ttl 64, id 21624, offset 0, flags [DF], proto TCP (6), length 52)
    192.168.56.1.48924 > 192.168.56.4.22: Flags [.], cksum 0xf17c (incorrect -> 0x81d2), ack 4325, win 593, options [nop,nop,TS val 1784548374 ecr 2995251478], length 0
13:40:34.584304 IP (tos 0x48, ttl 64, id 21625, offset 0, flags [DF], proto TCP (6), length 88)
    192.168.56.1.48924 > 192.168.56.4.22: Flags [P.], cksum 0xf1a0 (incorrect -> 0x5e18), seq 4106:4142, ack 4325, win 593, options [nop,nop,TS val 1784548497 ecr 2995251478], length 36
13:40:34.585930 IP (tos 0x10, ttl 64, id 10763, offset 0, flags [DF], proto TCP (6), length 88)
    192.168.56.4.22 > 192.168.56.1.48924: Flags [P.], cksum 0x03ac (correct), seq 4325:4361, ack 4142, win 501, options [nop,nop,TS val 2995251603 ecr 1784548497], length 36
13:40:34.586010 IP (tos 0x48, ttl 64, id 21626, offset 0, flags [DF], proto TCP (6), length 52)
    192.168.56.1.48924 > 192.168.56.4.22: Flags [.], cksum 0xf17c (incorrect -> 0x8090), ack 4361, win 593, options [nop,nop,TS val 1784548499 ecr 2995251603], length 0
13:40:34.687924 IP (tos 0x48, ttl 64, id 21627, offset 0, flags [DF], proto TCP (6), length 88)
    192.168.56.1.48924 > 192.168.56.4.22: Flags [P.], cksum 0xf1a0 (incorrect -> 0x2458), seq 4142:4178, ack 4361, win 593, options [nop,nop,TS val 1784548601 ecr 2995251603], length 36
13:40:34.689699 IP (tos 0x10, ttl 64, id 10764, offset 0, flags [DF], proto TCP (6), length 88)
    192.168.56.4.22 > 192.168.56.1.48924: Flags [P.], cksum 0xdf24 (correct), seq 4361:4397, ack 4178, win 501, options [nop,nop,TS val 2995251707 ecr 1784548601], length 36
13:40:34.689756 IP (tos 0x48, ttl 64, id 21628, offset 0, flags [DF], proto TCP (6), length 52)
    192.168.56.1.48924 > 192.168.56.4.22: Flags [.], cksum 0xf17c (incorrect -> 0x7f78), ack 4397, win 593, options [nop,nop,TS val 1784548603 ecr 2995251707], length 0
13:40:34.750499 IP (tos 0x48, ttl 64, id 21629, offset 0, flags [DF], proto TCP (6), length 88)
    192.168.56.1.48924 > 192.168.56.4.22: Flags [P.], cksum 0xf1a0 (incorrect -> 0xb31f), seq 4178:4214, ack 4397, win 593, options [nop,nop,TS val 1784548664 ecr 2995251707], length 36
13:40:34.752511 IP (tos 0x10, ttl 64, id 10765, offset 0, flags [DF], proto TCP (6), length 88)
    192.168.56.4.22 > 192.168.56.1.48924: Flags [P.], cksum 0x1a10 (correct), seq 4397:4433, ack 4214, win 501, options [nop,nop,TS val 2995251770 ecr 1784548664], length 36
13:40:34.752564 IP (tos 0x48, ttl 64, id 21630, offset 0, flags [DF], proto TCP (6), length 52)
    192.168.56.1.48924 > 192.168.56.4.22: Flags [.], cksum 0xf17c (incorrect -> 0x7eb2), ack 4433, win 593, options [nop,nop,TS val 1784548666 ecr 2995251770], length 0
13:40:35.246044 IP (tos 0x48, ttl 64, id 21631, offset 0, flags [DF], proto TCP (6), length 88)
    192.168.56.1.48924 > 192.168.56.4.22: Flags [P.], cksum 0xf1a0 (incorrect -> 0x6eeb), seq 4214:4250, ack 4433, win 593, options [nop,nop,TS val 1784549159 ecr 2995251770], length 36
13:40:35.247750 IP (tos 0x10, ttl 64, id 10766, offset 0, flags [DF], proto TCP (6), length 88)
    192.168.56.4.22 > 192.168.56.1.48924: Flags [P.], cksum 0x1d73 (correct), seq 4433:4469, ack 4250, win 501, options [nop,nop,TS val 2995252265 ecr 1784549159], length 36
13:40:35.247793 IP (tos 0x48, ttl 64, id 21632, offset 0, flags [DF], proto TCP (6), length 52)
    192.168.56.1.48924 > 192.168.56.4.22: Flags [.], cksum 0xf17c (incorrect -> 0x7a8c), ack 4469, win 593, options [nop,nop,TS val 1784549161 ecr 2995252265], length 0
13:40:35.330941 IP (tos 0x48, ttl 64, id 21633, offset 0, flags [DF], proto TCP (6), length 88)
    192.168.56.1.48924 > 192.168.56.4.22: Flags [P.], cksum 0xf1a0 (incorrect -> 0xde1b), seq 4250:4286, ack 4469, win 593, options [nop,nop,TS val 1784549244 ecr 2995252265], length 36
13:40:35.332694 IP (tos 0x10, ttl 64, id 10767, offset 0, flags [DF], proto TCP (6), length 88)
    192.168.56.4.22 > 192.168.56.1.48924: Flags [P.], cksum 0xa32a (correct), seq 4469:4505, ack 4286, win 501, options [nop,nop,TS val 2995252350 ecr 1784549244], length 36
13:40:35.332726 IP (tos 0x48, ttl 64, id 21634, offset 0, flags [DF], proto TCP (6), length 52)
    192.168.56.1.48924 > 192.168.56.4.22: Flags [.], cksum 0xf17c (incorrect -> 0x799a), ack 4505, win 593, options [nop,nop,TS val 1784549246 ecr 2995252350], length 0
13:40:37.599211 IP (tos 0x48, ttl 64, id 21635, offset 0, flags [DF], proto TCP (6), length 88)
    192.168.56.1.48924 > 192.168.56.4.22: Flags [P.], cksum 0xf1a0 (incorrect -> 0xcef1), seq 4286:4322, ack 4505, win 593, options [nop,nop,TS val 1784551512 ecr 2995252350], length 36
13:40:37.601379 IP (tos 0x10, ttl 64, id 10768, offset 0, flags [DF], proto TCP (6), length 88)
    192.168.56.4.22 > 192.168.56.1.48924: Flags [P.], cksum 0x2596 (correct), seq 4505:4541, ack 4322, win 501, options [nop,nop,TS val 2995254619 ecr 1784551512], length 36
13:40:37.601418 IP (tos 0x48, ttl 64, id 21636, offset 0, flags [DF], proto TCP (6), length 52)
    192.168.56.1.48924 > 192.168.56.4.22: Flags [.], cksum 0xf17c (incorrect -> 0x6798), ack 4541, win 593, options [nop,nop,TS val 1784551515 ecr 2995254619], length 0
13:40:37.603441 IP (tos 0x10, ttl 64, id 10769, offset 0, flags [DF], proto TCP (6), length 184)
    192.168.56.4.22 > 192.168.56.1.48924: Flags [P.], cksum 0x23f1 (correct), seq 4541:4673, ack 4322, win 501, options [nop,nop,TS val 2995254621 ecr 1784551515], length 132
13:40:37.603477 IP (tos 0x48, ttl 64, id 21637, offset 0, flags [DF], proto TCP (6), length 52)
    192.168.56.1.48924 > 192.168.56.4.22: Flags [.], cksum 0xf17c (incorrect -> 0x66f9), ack 4673, win 616, options [nop,nop,TS val 1784551517 ecr 2995254621], length 0
13:40:37.604524 IP (tos 0x10, ttl 64, id 10770, offset 0, flags [DF], proto TCP (6), length 120)
    192.168.56.4.22 > 192.168.56.1.48924: Flags [P.], cksum 0xdff3 (correct), seq 4673:4741, ack 4322, win 501, options [nop,nop,TS val 2995254622 ecr 1784551517], length 68
13:40:37.604552 IP (tos 0x48, ttl 64, id 21638, offset 0, flags [DF], proto TCP (6), length 52)
    192.168.56.1.48924 > 192.168.56.4.22: Flags [.], cksum 0xf17c (incorrect -> 0x66b3), ack 4741, win 616, options [nop,nop,TS val 1784551518 ecr 2995254622], length 0
13:43:53.017640 IP (tos 0x48, ttl 64, id 21639, offset 0, flags [DF], proto TCP (6), length 96)
    192.168.56.1.48924 > 192.168.56.4.22: Flags [P.], cksum 0xf1a8 (incorrect -> 0x0135), seq 4322:4366, ack 4741, win 616, options [nop,nop,TS val 1784746931 ecr 2995254622], length 44
13:43:53.019440 IP (tos 0x10, ttl 64, id 10771, offset 0, flags [DF], proto TCP (6), length 88)
    192.168.56.4.22 > 192.168.56.1.48924: Flags [P.], cksum 0xdfda (correct), seq 4741:4777, ack 4366, win 501, options [nop,nop,TS val 2995450042 ecr 1784746931], length 36
13:43:53.019481 IP (tos 0x48, ttl 64, id 21640, offset 0, flags [DF], proto TCP (6), length 52)
    192.168.56.1.48924 > 192.168.56.4.22: Flags [.], cksum 0xf17c (incorrect -> 0x6faa), ack 4777, win 616, options [nop,nop,TS val 1784746933 ecr 2995450042], length 0
13:43:53.019857 IP (tos 0x10, ttl 64, id 10772, offset 0, flags [DF], proto TCP (6), length 96)
    192.168.56.4.22 > 192.168.56.1.48924: Flags [P.], cksum 0xd9dc (correct), seq 4777:4821, ack 4366, win 501, options [nop,nop,TS val 2995450042 ecr 1784746933], length 44
13:43:53.019880 IP (tos 0x48, ttl 64, id 21641, offset 0, flags [DF], proto TCP (6), length 52)
    192.168.56.1.48924 > 192.168.56.4.22: Flags [.], cksum 0xf17c (incorrect -> 0x6f7e), ack 4821, win 616, options [nop,nop,TS val 1784746933 ecr 2995450042], length 0
13:43:53.960042 IP (tos 0x48, ttl 64, id 21642, offset 0, flags [DF], proto TCP (6), length 88)
    192.168.56.1.48924 > 192.168.56.4.22: Flags [P.], cksum 0xf1a0 (incorrect -> 0x64c4), seq 4366:4402, ack 4821, win 616, options [nop,nop,TS val 1784747873 ecr 2995450042], length 36
13:43:53.962936 IP (tos 0x10, ttl 64, id 10773, offset 0, flags [DF], proto TCP (6), length 96)
    192.168.56.4.22 > 192.168.56.1.48924: Flags [P.], cksum 0x5422 (correct), seq 4821:4865, ack 4402, win 501, options [nop,nop,TS val 2995450985 ecr 1784747873], length 44
13:43:53.962973 IP (tos 0x48, ttl 64, id 21643, offset 0, flags [DF], proto TCP (6), length 52)
    192.168.56.1.48924 > 192.168.56.4.22: Flags [.], cksum 0xf17c (incorrect -> 0x67d0), ack 4865, win 616, options [nop,nop,TS val 1784747876 ecr 2995450985], length 0
13:43:54.103858 IP (tos 0x48, ttl 64, id 21644, offset 0, flags [DF], proto TCP (6), length 88)
    192.168.56.1.48924 > 192.168.56.4.22: Flags [P.], cksum 0xf1a0 (incorrect -> 0xaa5f), seq 4402:4438, ack 4865, win 616, options [nop,nop,TS val 1784748017 ecr 2995450985], length 36
13:43:54.105237 IP (tos 0x10, ttl 64, id 10774, offset 0, flags [DF], proto TCP (6), length 96)
    192.168.56.4.22 > 192.168.56.1.48924: Flags [P.], cksum 0xd794 (correct), seq 4865:4909, ack 4438, win 501, options [nop,nop,TS val 2995451127 ecr 1784748017], length 44
13:43:54.105285 IP (tos 0x48, ttl 64, id 21645, offset 0, flags [DF], proto TCP (6), length 52)
    192.168.56.1.48924 > 192.168.56.4.22: Flags [.], cksum 0xf17c (incorrect -> 0x6664), ack 4909, win 616, options [nop,nop,TS val 1784748018 ecr 2995451127], length 0
13:43:54.268350 IP (tos 0x48, ttl 64, id 21646, offset 0, flags [DF], proto TCP (6), length 88)
    192.168.56.1.48924 > 192.168.56.4.22: Flags [P.], cksum 0xf1a0 (incorrect -> 0x75b6), seq 4438:4474, ack 4909, win 616, options [nop,nop,TS val 1784748182 ecr 2995451127], length 36
13:43:54.269706 IP (tos 0x10, ttl 64, id 10775, offset 0, flags [DF], proto TCP (6), length 96)
    192.168.56.4.22 > 192.168.56.1.48924: Flags [P.], cksum 0x5212 (correct), seq 4909:4953, ack 4474, win 501, options [nop,nop,TS val 2995451292 ecr 1784748182], length 44
13:43:54.269775 IP (tos 0x48, ttl 64, id 21647, offset 0, flags [DF], proto TCP (6), length 52)
    192.168.56.1.48924 > 192.168.56.4.22: Flags [.], cksum 0xf17c (incorrect -> 0x64ca), ack 4953, win 616, options [nop,nop,TS val 1784748183 ecr 2995451292], length 0
13:43:54.369529 IP (tos 0x48, ttl 64, id 21648, offset 0, flags [DF], proto TCP (6), length 88)
    192.168.56.1.48924 > 192.168.56.4.22: Flags [P.], cksum 0xf1a0 (incorrect -> 0xb9e6), seq 4474:4510, ack 4953, win 616, options [nop,nop,TS val 1784748283 ecr 2995451292], length 36
13:43:54.370923 IP (tos 0x10, ttl 64, id 10776, offset 0, flags [DF], proto TCP (6), length 96)
    192.168.56.4.22 > 192.168.56.1.48924: Flags [P.], cksum 0xe9a2 (correct), seq 4953:4997, ack 4510, win 501, options [nop,nop,TS val 2995451393 ecr 1784748283], length 44
13:43:54.370967 IP (tos 0x48, ttl 64, id 21649, offset 0, flags [DF], proto TCP (6), length 52)
    192.168.56.1.48924 > 192.168.56.4.22: Flags [.], cksum 0xf17c (incorrect -> 0x63b0), ack 4997, win 616, options [nop,nop,TS val 1784748284 ecr 2995451393], length 0
13:43:54.514188 IP (tos 0x48, ttl 64, id 21650, offset 0, flags [DF], proto TCP (6), length 88)
    192.168.56.1.48924 > 192.168.56.4.22: Flags [P.], cksum 0xf1a0 (incorrect -> 0xe819), seq 4510:4546, ack 4997, win 616, options [nop,nop,TS val 1784748427 ecr 2995451393], length 36
13:43:54.516151 IP (tos 0x10, ttl 64, id 10777, offset 0, flags [DF], proto TCP (6), length 96)
    192.168.56.4.22 > 192.168.56.1.48924: Flags [P.], cksum 0x8386 (correct), seq 4997:5041, ack 4546, win 501, options [nop,nop,TS val 2995451538 ecr 1784748427], length 44
13:43:54.516196 IP (tos 0x48, ttl 64, id 21651, offset 0, flags [DF], proto TCP (6), length 52)
    192.168.56.1.48924 > 192.168.56.4.22: Flags [.], cksum 0xf17c (incorrect -> 0x623e), ack 5041, win 616, options [nop,nop,TS val 1784748429 ecr 2995451538], length 0
13:43:54.637114 IP (tos 0x48, ttl 64, id 21652, offset 0, flags [DF], proto TCP (6), length 88)
    192.168.56.1.48924 > 192.168.56.4.22: Flags [P.], cksum 0xf1a0 (incorrect -> 0xad6d), seq 4546:4582, ack 5041, win 616, options [nop,nop,TS val 1784748550 ecr 2995451538], length 36
13:43:54.638238 IP (tos 0x10, ttl 64, id 10778, offset 0, flags [DF], proto TCP (6), length 52)
    192.168.56.4.22 > 192.168.56.1.48924: Flags [.], cksum 0x619a (correct), ack 4582, win 501, options [nop,nop,TS val 2995451660 ecr 1784748550], length 0
13:43:54.638301 IP (tos 0x10, ttl 64, id 10779, offset 0, flags [DF], proto TCP (6), length 88)
    192.168.56.4.22 > 192.168.56.1.48924: Flags [P.], cksum 0x1e8c (correct), seq 5041:5077, ack 4582, win 501, options [nop,nop,TS val 2995451661 ecr 1784748550], length 36
13:43:54.638332 IP (tos 0x48, ttl 64, id 21653, offset 0, flags [DF], proto TCP (6), length 52)
    192.168.56.1.48924 > 192.168.56.4.22: Flags [.], cksum 0xf17c (incorrect -> 0x6101), ack 5077, win 616, options [nop,nop,TS val 1784748551 ecr 2995451661], length 0
13:46:56.039487 IP (tos 0x48, ttl 64, id 23947, offset 0, flags [DF], proto TCP (6), length 60)
    192.168.56.1.39984 > 192.168.56.4.22: Flags [S], cksum 0xf184 (incorrect -> 0x1dee), seq 755772275, win 64240, options [mss 1460,sackOK,TS val 1784929953 ecr 0,nop,wscale 7], length 0
13:46:56.040055 IP (tos 0x0, ttl 64, id 0, offset 0, flags [DF], proto TCP (6), length 60)
    192.168.56.4.22 > 192.168.56.1.39984: Flags [S.], cksum 0x9812 (correct), seq 3517334099, ack 755772276, win 65160, options [mss 1460,sackOK,TS val 2995633066 ecr 1784929953,nop,wscale 7], length 0
13:46:56.040093 IP (tos 0x48, ttl 64, id 23948, offset 0, flags [DF], proto TCP (6), length 52)
    192.168.56.1.39984 > 192.168.56.4.22: Flags [.], cksum 0xf17c (incorrect -> 0xc371), ack 1, win 502, options [nop,nop,TS val 1784929953 ecr 2995633066], length 0
13:46:56.040465 IP (tos 0x48, ttl 64, id 23949, offset 0, flags [DF], proto TCP (6), length 73)
    192.168.56.1.39984 > 192.168.56.4.22: Flags [P.], cksum 0xf191 (incorrect -> 0xf8aa), seq 1:22, ack 1, win 502, options [nop,nop,TS val 1784929954 ecr 2995633066], length 21: SSH: SSH-2.0-OpenSSH_9.9
13:46:56.040672 IP (tos 0x0, ttl 64, id 52396, offset 0, flags [DF], proto TCP (6), length 52)
    192.168.56.4.22 > 192.168.56.1.39984: Flags [.], cksum 0xc353 (correct), ack 22, win 509, options [nop,nop,TS val 2995633067 ecr 1784929954], length 0
13:46:56.058324 IP (tos 0x0, ttl 64, id 52397, offset 0, flags [DF], proto TCP (6), length 92)
    192.168.56.4.22 > 192.168.56.1.39984: Flags [P.], cksum 0x5e40 (correct), seq 1:41, ack 22, win 509, options [nop,nop,TS val 2995633085 ecr 1784929954], length 40: SSH: SSH-2.0-OpenSSH_9.2p1 Debian-2+deb12u3
13:46:56.058371 IP (tos 0x48, ttl 64, id 23950, offset 0, flags [DF], proto TCP (6), length 52)
    192.168.56.1.39984 > 192.168.56.4.22: Flags [.], cksum 0xf17c (incorrect -> 0xc30e), ack 41, win 502, options [nop,nop,TS val 1784929972 ecr 2995633085], length 0
13:46:56.059045 IP (tos 0x48, ttl 64, id 23951, offset 0, flags [DF], proto TCP (6), length 1620)
    192.168.56.1.39984 > 192.168.56.4.22: Flags [P.], cksum 0xf79c (incorrect -> 0xa683), seq 22:1590, ack 41, win 502, options [nop,nop,TS val 1784929972 ecr 2995633085], length 1568
13:46:56.061063 IP (tos 0x0, ttl 64, id 52398, offset 0, flags [DF], proto TCP (6), length 1164)
    192.168.56.4.22 > 192.168.56.1.39984: Flags [P.], cksum 0x8898 (correct), seq 41:1153, ack 1590, win 500, options [nop,nop,TS val 2995633088 ecr 1784929972], length 1112
13:46:56.102167 IP (tos 0x48, ttl 64, id 23953, offset 0, flags [DF], proto TCP (6), length 52)
    192.168.56.1.39984 > 192.168.56.4.22: Flags [.], cksum 0xf17c (incorrect -> 0xb852), ack 1153, win 524, options [nop,nop,TS val 1784930015 ecr 2995633088], length 0
13:46:56.127759 IP (tos 0x48, ttl 64, id 23954, offset 0, flags [DF], proto TCP (6), length 1260)
    192.168.56.1.39984 > 192.168.56.4.22: Flags [P.], cksum 0xf634 (incorrect -> 0x1064), seq 1590:2798, ack 1153, win 524, options [nop,nop,TS val 1784930041 ecr 2995633088], length 1208
13:46:56.147823 IP (tos 0x0, ttl 64, id 52399, offset 0, flags [DF], proto TCP (6), length 1616)
    192.168.56.4.22 > 192.168.56.1.39984: Flags [P.], cksum 0xf798 (incorrect -> 0xc5c5), seq 1153:2717, ack 2798, win 501, options [nop,nop,TS val 2995633174 ecr 1784930041], length 1564
13:46:56.147860 IP (tos 0x48, ttl 64, id 23955, offset 0, flags [DF], proto TCP (6), length 52)
    192.168.56.1.39984 > 192.168.56.4.22: Flags [.], cksum 0xf17c (incorrect -> 0xace2), ack 2717, win 548, options [nop,nop,TS val 1784930061 ecr 2995633174], length 0
13:46:56.156078 IP (tos 0x48, ttl 64, id 23956, offset 0, flags [DF], proto TCP (6), length 68)
    192.168.56.1.39984 > 192.168.56.4.22: Flags [P.], cksum 0xf18c (incorrect -> 0xa2a1), seq 2798:2814, ack 2717, win 548, options [nop,nop,TS val 1784930069 ecr 2995633174], length 16
13:46:56.342898 IP (tos 0x0, ttl 64, id 52401, offset 0, flags [DF], proto TCP (6), length 52)
    192.168.56.4.22 > 192.168.56.1.39984: Flags [.], cksum 0xac36 (correct), ack 2814, win 501, options [nop,nop,TS val 2995633369 ecr 1784930069], length 0
13:46:56.342949 IP (tos 0x48, ttl 64, id 23957, offset 0, flags [DF], proto TCP (6), length 96)
    192.168.56.1.39984 > 192.168.56.4.22: Flags [P.], cksum 0xf1a8 (incorrect -> 0x8ae6), seq 2814:2858, ack 2717, win 548, options [nop,nop,TS val 1784930256 ecr 2995633369], length 44
13:46:56.343184 IP (tos 0x0, ttl 64, id 52402, offset 0, flags [DF], proto TCP (6), length 52)
    192.168.56.4.22 > 192.168.56.1.39984: Flags [.], cksum 0xab4e (correct), ack 2858, win 501, options [nop,nop,TS val 2995633370 ecr 1784930256], length 0
13:46:56.343855 IP (tos 0x0, ttl 64, id 52403, offset 0, flags [DF], proto TCP (6), length 96)
    192.168.56.4.22 > 192.168.56.1.39984: Flags [P.], cksum 0x7519 (correct), seq 2717:2761, ack 2858, win 501, options [nop,nop,TS val 2995633370 ecr 1784930256], length 44
13:46:56.344064 IP (tos 0x48, ttl 64, id 23958, offset 0, flags [DF], proto TCP (6), length 112)
    192.168.56.1.39984 > 192.168.56.4.22: Flags [P.], cksum 0xf1b8 (incorrect -> 0x55a7), seq 2858:2918, ack 2761, win 548, options [nop,nop,TS val 1784930257 ecr 2995633370], length 60
13:46:56.351333 IP (tos 0x0, ttl 64, id 52404, offset 0, flags [DF], proto TCP (6), length 104)
    192.168.56.4.22 > 192.168.56.1.39984: Flags [P.], cksum 0x8164 (correct), seq 2761:2813, ack 2918, win 501, options [nop,nop,TS val 2995633378 ecr 1784930257], length 52
13:46:56.351638 IP (tos 0x48, ttl 64, id 23959, offset 0, flags [DF], proto TCP (6), length 552)
    192.168.56.1.39984 > 192.168.56.4.22: Flags [P.], cksum 0xf370 (incorrect -> 0x1cb8), seq 2918:3418, ack 2813, win 548, options [nop,nop,TS val 1784930265 ecr 2995633378], length 500
13:46:56.360655 IP (tos 0x0, ttl 64, id 52405, offset 0, flags [DF], proto TCP (6), length 104)
    192.168.56.4.22 > 192.168.56.1.39984: Flags [P.], cksum 0x48c3 (correct), seq 2813:2865, ack 3418, win 501, options [nop,nop,TS val 2995633387 ecr 1784930265], length 52
13:46:56.405690 IP (tos 0x48, ttl 64, id 23960, offset 0, flags [DF], proto TCP (6), length 52)
    192.168.56.1.39984 > 192.168.56.4.22: Flags [.], cksum 0xf17c (incorrect -> 0xa80b), ack 2865, win 548, options [nop,nop,TS val 1784930319 ecr 2995633387], length 0
13:46:58.811441 IP (tos 0x48, ttl 64, id 23961, offset 0, flags [DF], proto TCP (6), length 136)
    192.168.56.1.39984 > 192.168.56.4.22: Flags [P.], cksum 0xf1d0 (incorrect -> 0x97f5), seq 3418:3502, ack 2865, win 548, options [nop,nop,TS val 1784932725 ecr 2995633387], length 84
13:46:58.852338 IP (tos 0x0, ttl 64, id 52406, offset 0, flags [DF], proto TCP (6), length 52)
    192.168.56.4.22 > 192.168.56.1.39984: Flags [.], cksum 0x94c4 (correct), ack 3502, win 501, options [nop,nop,TS val 2995635879 ecr 1784932725], length 0
13:46:58.865413 IP (tos 0x0, ttl 64, id 52407, offset 0, flags [DF], proto TCP (6), length 80)
    192.168.56.4.22 > 192.168.56.1.39984: Flags [P.], cksum 0x0a47 (correct), seq 2865:2893, ack 3502, win 501, options [nop,nop,TS val 2995635892 ecr 1784932725], length 28
13:46:58.865454 IP (tos 0x48, ttl 64, id 23962, offset 0, flags [DF], proto TCP (6), length 52)
    192.168.56.1.39984 > 192.168.56.4.22: Flags [.], cksum 0xf17c (incorrect -> 0x9436), ack 2893, win 548, options [nop,nop,TS val 1784932779 ecr 2995635892], length 0
13:46:58.865686 IP (tos 0x48, ttl 64, id 23963, offset 0, flags [DF], proto TCP (6), length 164)
    192.168.56.1.39984 > 192.168.56.4.22: Flags [P.], cksum 0xf1ec (incorrect -> 0xe0d7), seq 3502:3614, ack 2893, win 548, options [nop,nop,TS val 1784932779 ecr 2995635892], length 112
13:46:58.865869 IP (tos 0x0, ttl 64, id 52408, offset 0, flags [DF], proto TCP (6), length 52)
    192.168.56.4.22 > 192.168.56.1.39984: Flags [.], cksum 0x93f5 (correct), ack 3614, win 501, options [nop,nop,TS val 2995635892 ecr 1784932779], length 0
13:46:58.915789 IP (tos 0x0, ttl 64, id 52409, offset 0, flags [DF], proto TCP (6), length 680)
    192.168.56.4.22 > 192.168.56.1.39984: Flags [P.], cksum 0xa8c1 (correct), seq 2893:3521, ack 3614, win 501, options [nop,nop,TS val 2995635942 ecr 1784932779], length 628
13:46:58.959013 IP (tos 0x48, ttl 64, id 23964, offset 0, flags [DF], proto TCP (6), length 52)
    192.168.56.1.39984 > 192.168.56.4.22: Flags [.], cksum 0xf17c (incorrect -> 0x90ac), ack 3521, win 571, options [nop,nop,TS val 1784932872 ecr 2995635942], length 0
13:46:58.959764 IP (tos 0x0, ttl 64, id 52410, offset 0, flags [DF], proto TCP (6), length 96)
    192.168.56.4.22 > 192.168.56.1.39984: Flags [P.], cksum 0xd300 (correct), seq 3521:3565, ack 3614, win 501, options [nop,nop,TS val 2995635986 ecr 1784932872], length 44
13:46:58.959827 IP (tos 0x48, ttl 64, id 23965, offset 0, flags [DF], proto TCP (6), length 52)
    192.168.56.1.39984 > 192.168.56.4.22: Flags [.], cksum 0xf17c (incorrect -> 0x9053), ack 3565, win 571, options [nop,nop,TS val 1784932873 ecr 2995635986], length 0
13:46:58.960066 IP (tos 0x20, ttl 64, id 23966, offset 0, flags [DF], proto TCP (6), length 104)
    192.168.56.1.39984 > 192.168.56.4.22: Flags [P.], cksum 0xf1b0 (incorrect -> 0x2eb1), seq 3614:3666, ack 3565, win 571, options [nop,nop,TS val 1784932873 ecr 2995635986], length 52
13:46:58.960671 IP (tos 0x0, ttl 64, id 52411, offset 0, flags [DF], proto TCP (6), length 52)
    192.168.56.4.22 > 192.168.56.1.39984: Flags [.], cksum 0x9064 (correct), ack 3666, win 501, options [nop,nop,TS val 2995635987 ecr 1784932873], length 0
13:46:58.963873 IP (tos 0x8, ttl 64, id 52412, offset 0, flags [DF], proto TCP (6), length 124)
    192.168.56.4.22 > 192.168.56.1.39984: Flags [P.], cksum 0x70ae (correct), seq 3565:3637, ack 3666, win 501, options [nop,nop,TS val 2995635990 ecr 1784932873], length 72
13:46:58.964135 IP (tos 0x20, ttl 64, id 23967, offset 0, flags [DF], proto TCP (6), length 96)
    192.168.56.1.39984 > 192.168.56.4.22: Flags [P.], cksum 0xf1a8 (incorrect -> 0x880a), seq 3666:3710, ack 3637, win 571, options [nop,nop,TS val 1784932877 ecr 2995635990], length 44
13:46:58.971416 IP (tos 0x8, ttl 64, id 52413, offset 0, flags [DF], proto TCP (6), length 408)
    192.168.56.4.22 > 192.168.56.1.39984: Flags [P.], cksum 0xc8df (correct), seq 3637:3993, ack 3710, win 501, options [nop,nop,TS val 2995635998 ecr 1784932877], length 356
13:46:58.971798 IP (tos 0x20, ttl 64, id 23968, offset 0, flags [DF], proto TCP (6), length 120)
    192.168.56.1.39984 > 192.168.56.4.22: Flags [P.], cksum 0xf1c0 (incorrect -> 0x9857), seq 3710:3778, ack 3993, win 593, options [nop,nop,TS val 1784932885 ecr 2995635998], length 68
13:46:58.972778 IP (tos 0x8, ttl 64, id 52414, offset 0, flags [DF], proto TCP (6), length 128)
    192.168.56.4.22 > 192.168.56.1.39984: Flags [P.], cksum 0x59b0 (correct), seq 3993:4069, ack 3778, win 501, options [nop,nop,TS val 2995635999 ecr 1784932885], length 76
13:46:58.973086 IP (tos 0x20, ttl 64, id 23969, offset 0, flags [DF], proto TCP (6), length 112)
    192.168.56.1.39984 > 192.168.56.4.22: Flags [P.], cksum 0xf1b8 (incorrect -> 0x1087), seq 3778:3838, ack 4069, win 593, options [nop,nop,TS val 1784932886 ecr 2995635999], length 60
13:46:58.973725 IP (tos 0x8, ttl 64, id 52415, offset 0, flags [DF], proto TCP (6), length 128)
    192.168.56.4.22 > 192.168.56.1.39984: Flags [P.], cksum 0x2965 (correct), seq 4069:4145, ack 3838, win 501, options [nop,nop,TS val 2995636000 ecr 1784932886], length 76
13:46:58.973979 IP (tos 0x20, ttl 64, id 23970, offset 0, flags [DF], proto TCP (6), length 144)
    192.168.56.1.39984 > 192.168.56.4.22: Flags [P.], cksum 0xf1d8 (incorrect -> 0x649d), seq 3838:3930, ack 4145, win 593, options [nop,nop,TS val 1784932887 ecr 2995636000], length 92
13:46:58.975414 IP (tos 0x8, ttl 64, id 52416, offset 0, flags [DF], proto TCP (6), length 104)
    192.168.56.4.22 > 192.168.56.1.39984: Flags [P.], cksum 0x6e5f (correct), seq 4145:4197, ack 3930, win 501, options [nop,nop,TS val 2995636002 ecr 1784932887], length 52
13:46:58.975776 IP (tos 0x20, ttl 64, id 23971, offset 0, flags [DF], proto TCP (6), length 208)
    192.168.56.1.39984 > 192.168.56.4.22: Flags [P.], cksum 0xf218 (incorrect -> 0x26d9), seq 3930:4086, ack 4197, win 593, options [nop,nop,TS val 1784932889 ecr 2995636002], length 156
13:46:58.976798 IP (tos 0x8, ttl 64, id 52417, offset 0, flags [DF], proto TCP (6), length 120)
    192.168.56.4.22 > 192.168.56.1.39984: Flags [P.], cksum 0x17a9 (correct), seq 4197:4265, ack 4086, win 501, options [nop,nop,TS val 2995636003 ecr 1784932889], length 68
13:46:58.977171 IP (tos 0x20, ttl 64, id 23972, offset 0, flags [DF], proto TCP (6), length 120)
    192.168.56.1.39984 > 192.168.56.4.22: Flags [P.], cksum 0xf1c0 (incorrect -> 0xa026), seq 4086:4154, ack 4265, win 593, options [nop,nop,TS val 1784932890 ecr 2995636003], length 68
13:46:58.977835 IP (tos 0x8, ttl 64, id 52418, offset 0, flags [DF], proto TCP (6), length 120)
    192.168.56.4.22 > 192.168.56.1.39984: Flags [P.], cksum 0x26a0 (correct), seq 4265:4333, ack 4154, win 501, options [nop,nop,TS val 2995636004 ecr 1784932890], length 68
13:46:58.978049 IP (tos 0x20, ttl 64, id 23973, offset 0, flags [DF], proto TCP (6), length 104)
    192.168.56.1.39984 > 192.168.56.4.22: Flags [P.], cksum 0xf1b0 (incorrect -> 0x8369), seq 4154:4206, ack 4333, win 593, options [nop,nop,TS val 1784932891 ecr 2995636004], length 52
13:46:58.978644 IP (tos 0x8, ttl 64, id 52419, offset 0, flags [DF], proto TCP (6), length 120)
    192.168.56.4.22 > 192.168.56.1.39984: Flags [P.], cksum 0xe184 (correct), seq 4333:4401, ack 4206, win 501, options [nop,nop,TS val 2995636005 ecr 1784932891], length 68
13:46:58.978787 IP (tos 0x20, ttl 64, id 23974, offset 0, flags [DF], proto TCP (6), length 88)
    192.168.56.1.39984 > 192.168.56.4.22: Flags [P.], cksum 0xf1a0 (incorrect -> 0xfd96), seq 4206:4242, ack 4401, win 593, options [nop,nop,TS val 1784932892 ecr 2995636005], length 36
13:46:58.979535 IP (tos 0x8, ttl 64, id 52420, offset 0, flags [DF], proto TCP (6), length 176)
